-- phpMyAdmin SQL Dump
-- version 5.2.1
-- https://www.phpmyadmin.net/
--
-- Máy chủ: 125.253.125.27
-- Thời gian đã tạo: Th10 04, 2025 lúc 10:34 AM
-- Phiên bản máy phục vụ: 10.10.2-MariaDB
-- Phiên bản PHP: 8.2.4

SET SQL_MODE = "NO_AUTO_VALUE_ON_ZERO";
START TRANSACTION;
SET time_zone = "+00:00";


/*!40101 SET @OLD_CHARACTER_SET_CLIENT=@@CHARACTER_SET_CLIENT */;
/*!40101 SET @OLD_CHARACTER_SET_RESULTS=@@CHARACTER_SET_RESULTS */;
/*!40101 SET @OLD_COLLATION_CONNECTION=@@COLLATION_CONNECTION */;
/*!40101 SET NAMES utf8mb4 */;

--
-- Cơ sở dữ liệu: `ca_ctm`
--

-- --------------------------------------------------------

--
-- Cấu trúc bảng cho bảng `order_item`
--

CREATE TABLE `order_item` (
  `id` int(11) NOT NULL,
  `order_id` int(11) NOT NULL,
  `order_store_id` int(11) NOT NULL,
  `product_id` int(11) NOT NULL,
  `product_price_id` int(11) NOT NULL,
  `product_seller_id` int(11) DEFAULT NULL,
  `seller_id` int(11) DEFAULT NULL,
  `name` varchar(255) DEFAULT NULL,
  `price` double(20,2) DEFAULT 0.00,
  `expense` double(20,2) DEFAULT 0.00,
  `quantity` int(11) DEFAULT 0,
  `seller_discount` double(20,2) DEFAULT 0.00,
  `total` double(20,2) DEFAULT 0.00,
  `is_rate` tinyint(1) DEFAULT 0,
  `promotion_id` int(11) DEFAULT NULL,
  `discount_value` double(20,2) DEFAULT 0.00,
  `discount_name` varchar(250) DEFAULT NULL,
  `created_at` datetime DEFAULT NULL,
  `updated_at` datetime DEFAULT NULL,
  `created_by` int(11) DEFAULT NULL,
  `updated_by` int(11) DEFAULT NULL
) ENGINE=InnoDB DEFAULT CHARSET=utf8mb4 COLLATE=utf8mb4_unicode_ci;

--
-- Đang đổ dữ liệu cho bảng `order_item`
--

INSERT INTO `order_item` (`id`, `order_id`, `order_store_id`, `product_id`, `product_price_id`, `product_seller_id`, `seller_id`, `name`, `price`, `expense`, `quantity`, `seller_discount`, `total`, `is_rate`, `promotion_id`, `discount_value`, `discount_name`, `created_at`, `updated_at`, `created_by`, `updated_by`) VALUES
(1, 1, 1, 838, 450, NULL, NULL, 'Táo Gala Pháp', 69000.00, 48300.00, 1, 0.00, 48300.00, 0, 2, 20700.00, 'Flash Sale 06:00 AM giảm 30% áp dụng lúc 06:00 ngày 15/11/2024', '2024-11-15 09:08:23', '2024-11-15 09:08:23', 5, 5),
(2, 2, 2, 838, 450, NULL, NULL, 'Táo Gala Pháp', 69000.00, 48300.00, 2, 0.00, 96600.00, 0, 2, 20700.00, 'Flash Sale 06:00 AM giảm 30% áp dụng lúc 06:00 ngày 28/11/2024', '2024-11-28 09:17:38', '2024-11-28 09:17:38', 5, 5),
(3, 3, 3, 838, 450, NULL, NULL, 'Táo Gala Pháp', 69000.00, 48300.00, 2, 0.00, 96600.00, 0, 2, 20700.00, 'Flash Sale 06:00 AM giảm 30% áp dụng lúc 06:00 ngày 28/11/2024', '2024-11-28 09:18:27', '2024-11-28 09:18:27', 5, 5),
(8, 8, 8, 833, 445, NULL, NULL, 'Tép', 88000.00, 61600.00, 1, 0.00, 61600.00, 0, 2, 26400.00, 'Flash Sale 06:00 AM giảm 30% áp dụng lúc 06:00 ngày 28/11/2024', '2024-11-28 09:54:19', '2024-11-28 09:54:19', 5, 5),
(9, 9, 9, 838, 450, NULL, NULL, 'Táo Gala Pháp', 69000.00, 48300.00, 1, 0.00, 48300.00, 0, 2, 20700.00, 'Flash Sale 06:00 AM giảm 30% áp dụng lúc 06:00 ngày 28/11/2024', '2024-11-28 09:54:40', '2024-11-28 09:54:40', 5, 5),
(15, 13, 13, 875, 491, NULL, NULL, 'Sản phẩm test', 10000.00, 10000.00, 3, 0.00, 30000.00, 0, NULL, 0.00, NULL, '2024-11-28 14:02:11', '2024-11-28 14:02:11', 5, 5),
(16, 14, 14, 875, 491, 8, 17, 'Sản phẩm test', 10000.00, 10000.00, 3, 0.00, 30000.00, 0, NULL, 0.00, NULL, '2024-11-28 14:12:12', '2024-11-28 14:12:12', 5, 5),
(17, 15, 15, 875, 491, 8, 17, 'Sản phẩm test', 10000.00, 10000.00, 3, 3000.00, 30000.00, 0, NULL, 0.00, NULL, '2024-11-28 15:30:16', '2024-11-28 15:30:16', 5, 5),
(18, 16, 16, 875, 491, NULL, NULL, 'Sản phẩm test', 10000.00, 10000.00, 4, 0.00, 40000.00, 0, NULL, 0.00, NULL, '2024-11-28 15:34:15', '2024-11-28 15:34:15', 5, 5),
(19, 17, 17, 875, 491, 8, 17, 'Sản phẩm test', 10000.00, 10000.00, 5, 5000.00, 50000.00, 0, NULL, 0.00, NULL, '2024-11-28 15:42:00', '2024-11-28 15:42:00', 5, 5),
(20, 18, 18, 875, 491, 8, 17, 'Sản phẩm test', 10000.00, 10000.00, 10, 10000.00, 100000.00, 0, NULL, 0.00, NULL, '2024-11-28 15:48:10', '2024-11-28 15:48:10', 5, 5),
(21, 19, 19, 875, 491, 8, 17, 'Sản phẩm test', 10000.00, 10000.00, 10, 10000.00, 100000.00, 0, NULL, 0.00, NULL, '2024-11-28 15:48:37', '2024-11-28 15:48:37', 5, 5),
(24, 22, 22, 838, 450, NULL, NULL, 'Táo Gala Pháp', 69000.00, 48300.00, 3, 0.00, 144900.00, 0, 2, 20700.00, 'Flash Sale 06:00 AM giảm 30% áp dụng lúc 06:00 ngày 07/01/2025', '2025-01-07 10:43:20', '2025-01-07 10:43:20', 5, 5),
(25, 23, 23, 880, 496, NULL, NULL, 'Sản phẩm test', 1000.00, 1000.00, 1, 0.00, 1000.00, 0, NULL, 0.00, NULL, '2025-01-17 14:42:37', '2025-01-17 14:42:37', 5, 5),
(26, 24, 24, 880, 496, NULL, NULL, 'Sản phẩm test', 1000.00, 1000.00, 1, 0.00, 1000.00, 0, NULL, 0.00, NULL, '2025-01-17 14:43:09', '2025-01-17 14:43:09', 44, 44),
(27, 25, 25, 880, 496, NULL, NULL, 'Sản phẩm test', 1000.00, 1000.00, 1, 0.00, 1000.00, 0, NULL, 0.00, NULL, '2025-01-20 11:06:58', '2025-01-20 11:06:58', 44, 44),
(28, 26, 26, 879, 495, NULL, NULL, 'Rượu nhung hươu', 600000.00, 600000.00, 1, 0.00, 600000.00, 0, NULL, 0.00, NULL, '2025-01-20 11:21:04', '2025-01-20 11:21:04', 44, 44),
(29, 27, 27, 880, 496, NULL, NULL, 'Sản phẩm test', 1000.00, 1000.00, 1, 0.00, 1000.00, 0, NULL, 0.00, NULL, '2025-01-20 12:03:59', '2025-01-20 12:03:59', 44, 44),
(30, 28, 28, 880, 496, NULL, NULL, 'Sản phẩm test', 1000.00, 1000.00, 1, 0.00, 1000.00, 0, NULL, 0.00, NULL, '2025-01-21 15:44:23', '2025-01-21 15:44:23', 5, 5),
(31, 29, 29, 880, 496, NULL, NULL, 'Sản phẩm test', 1000.00, 1000.00, 1, 0.00, 1000.00, 0, NULL, 0.00, NULL, '2025-01-22 09:57:47', '2025-01-22 09:57:47', 5, 5),
(32, 30, 30, 880, 496, NULL, NULL, 'Sản phẩm test', 1000.00, 1000.00, 1, 0.00, 1000.00, 0, NULL, 0.00, NULL, '2025-01-22 10:02:44', '2025-01-22 10:02:44', 5, 5),
(34, 32, 32, 880, 496, NULL, NULL, 'Sản phẩm test', 1000.00, 1000.00, 1, 0.00, 1000.00, 0, NULL, 0.00, NULL, '2025-01-23 10:07:50', '2025-01-23 10:07:50', 46, 46),
(35, 33, 33, 880, 496, NULL, NULL, 'Sản phẩm test', 1000.00, 1000.00, 1, 0.00, 1000.00, 0, NULL, 0.00, NULL, '2025-01-23 10:11:38', '2025-01-23 10:11:38', 46, 46),
(36, 34, 34, 880, 496, NULL, NULL, 'Sản phẩm test', 1000.00, 1000.00, 10, 0.00, 10000.00, 0, NULL, 0.00, NULL, '2025-01-23 11:18:38', '2025-01-23 11:18:38', 47, 47),
(37, 35, 35, 880, 496, NULL, NULL, 'Sản phẩm test', 1000.00, 1000.00, 1, 0.00, 1000.00, 0, NULL, 0.00, NULL, '2025-01-23 13:28:30', '2025-01-23 13:28:30', 46, 46),
(38, 36, 36, 880, 496, NULL, NULL, 'Sản phẩm test', 1000.00, 1000.00, 1, 0.00, 1000.00, 0, NULL, 0.00, NULL, '2025-01-23 13:40:48', '2025-01-23 13:40:48', 46, 46),
(39, 37, 37, 822, 434, 2, 17, 'Bột sắn', 10000.00, 10000.00, 2, 3000.00, 20000.00, 0, NULL, 0.00, NULL, '2025-01-23 14:29:21', '2025-01-23 14:29:21', 47, 47),
(40, 38, 38, 880, 496, NULL, NULL, 'Sản phẩm test', 1000.00, 1000.00, 1, 0.00, 1000.00, 0, NULL, 0.00, NULL, '2025-01-23 14:29:35', '2025-01-23 14:29:35', 5, 5),
(41, 39, 39, 877, 493, NULL, NULL, 'Rượu nhung hươu', 350000.00, 350000.00, 1, 0.00, 350000.00, 0, NULL, 0.00, NULL, '2025-01-23 18:05:58', '2025-01-23 18:05:58', 15, 15),
(42, 40, 40, 819, 431, NULL, NULL, 'Ớt tươi', 3500.00, 3500.00, 1, 0.00, 3500.00, 0, 4, 0.00, 'Flash Sale 06:00 PM giảm 0% áp dụng lúc 18:00 ngày 23/01/2025', '2025-01-23 20:45:31', '2025-01-23 20:45:31', 49, 49),
(43, 41, 41, 880, 496, NULL, NULL, 'Sản phẩm test', 1000.00, 1000.00, 20, 0.00, 20000.00, 0, NULL, 0.00, NULL, '2025-01-24 11:56:20', '2025-01-24 11:56:20', 5, 5),
(44, 42, 42, 871, 480, NULL, NULL, 'Tôm sú', 14600.00, 14600.00, 7, 0.00, 102200.00, 0, NULL, 0.00, NULL, '2025-01-24 15:48:18', '2025-01-24 15:48:18', 5, 5),
(45, 43, 43, 880, 496, NULL, NULL, 'Sản phẩm test', 1000.00, 1000.00, 100, 0.00, 100000.00, 0, NULL, 0.00, NULL, '2025-02-03 09:26:57', '2025-02-03 09:26:57', 5, 5),
(46, 44, 44, 880, 496, NULL, NULL, 'Sản phẩm test', 1000.00, 1000.00, 100, 0.00, 100000.00, 0, NULL, 0.00, NULL, '2025-02-03 09:47:30', '2025-02-03 09:47:30', 5, 5),
(47, 45, 45, 880, 496, NULL, NULL, 'Sản phẩm test', 1000.00, 1000.00, 1, 0.00, 1000.00, 0, NULL, 0.00, NULL, '2025-02-04 10:11:58', '2025-02-04 10:11:58', 46, 46),
(48, 46, 46, 880, 496, NULL, NULL, 'Sản phẩm test', 1000.00, 1000.00, 1, 0.00, 1000.00, 0, NULL, 0.00, NULL, '2025-02-06 10:26:37', '2025-02-06 10:26:37', 46, 46),
(49, 47, 47, 871, 480, NULL, NULL, 'Tôm sú', 14600.00, 14600.00, 1, 0.00, 14600.00, 0, NULL, 0.00, NULL, '2025-02-07 09:14:31', '2025-02-07 09:14:31', 49, 49),
(50, 48, 48, 879, 495, NULL, NULL, 'Rượu nhung hươu', 600000.00, 600000.00, 1, 0.00, 600000.00, 0, NULL, 0.00, NULL, '2025-02-11 15:49:21', '2025-02-11 15:49:21', 51, 51),
(51, 49, 49, 823, 435, NULL, NULL, 'Mật ong', 225000.00, 202500.00, 1, 0.00, 202500.00, 0, 1, 22500.00, 'Flash Sale 12:00 PM giảm 10% áp dụng lúc 12:00 ngày 11/02/2025', '2025-02-11 16:06:19', '2025-02-11 16:06:19', 16, 16),
(52, 50, 50, 825, 437, NULL, NULL, 'Đường mía', 15500.00, 13950.00, 1, 0.00, 13950.00, 0, 1, 1550.00, 'Flash Sale 12:00 PM giảm 10% áp dụng lúc 12:00 ngày 11/02/2025', '2025-02-11 16:41:06', '2025-02-11 16:41:06', 49, 49),
(53, 51, 51, 838, 450, NULL, NULL, 'Táo Gala Pháp', 69000.00, 58650.00, 2, 0.00, 117300.00, 0, 1, 10350.00, 'Flash Sale 12:00 PM giảm 15% áp dụng lúc 12:00 ngày 11/02/2025', '2025-02-11 16:49:04', '2025-02-11 16:49:04', 49, 49),
(54, 51, 51, 870, 479, NULL, NULL, 'Tôm thẻ', 100000.00, 85000.00, 2, 0.00, 170000.00, 0, 1, 15000.00, 'Flash Sale 12:00 PM giảm 15% áp dụng lúc 12:00 ngày 11/02/2025', '2025-02-11 16:49:04', '2025-02-11 16:49:04', 49, 49),
(55, 52, 52, 877, 493, NULL, NULL, 'Rượu nhung hươu', 350000.00, 350000.00, 2, 0.00, 700000.00, 0, NULL, 0.00, NULL, '2025-02-12 14:53:05', '2025-02-12 14:53:05', 53, 53),
(56, 53, 53, 838, 450, NULL, NULL, 'Táo Gala Pháp', 69000.00, 48300.00, 1, 0.00, 48300.00, 0, 2, 20700.00, 'Flash Sale 06:00 AM giảm 30% áp dụng lúc 06:00 ngày 13/02/2025', '2025-02-13 10:07:18', '2025-02-13 10:07:18', 53, 53),
(58, 55, 55, 880, 496, NULL, NULL, 'Sản phẩm test', 1000.00, 1000.00, 1, 0.00, 1000.00, 0, NULL, 0.00, NULL, '2025-02-17 09:31:28', '2025-02-17 09:31:28', 47, 47),
(61, 58, 58, 816, 428, NULL, NULL, 'Sầu riêng cấp đông', 112000.00, 95200.00, 1, 0.00, 95200.00, 0, 1, 16800.00, 'Flash Sale 12:00 PM giảm 15% áp dụng lúc 12:00 ngày 17/02/2025', '2025-02-17 17:40:05', '2025-02-17 17:40:05', 49, 49),
(65, 62, 62, 838, 450, NULL, NULL, 'Táo Gala Pháp', 69000.00, 48300.00, 1, 0.00, 48300.00, 0, 2, 20700.00, 'Flash Sale 06:00 AM giảm 30% áp dụng lúc 06:00 ngày 25/02/2025', '2025-02-25 09:55:55', '2025-02-25 09:55:55', 54, 54),
(66, 63, 63, 1094, 710, NULL, NULL, 'Hoa Quả Lắc', 35000.00, 35000.00, 1, 0.00, 35000.00, 0, NULL, 0.00, NULL, '2025-02-27 14:54:31', '2025-02-27 14:54:31', 32, 32),
(67, 64, 64, 837, 449, NULL, NULL, 'Cam sành vắt nước', 36500.00, 36500.00, 1, 0.00, 36500.00, 0, 4, 0.00, 'Flash Sale 06:00 PM giảm 0% áp dụng lúc 18:00 ngày 16/03/2025', '2025-03-16 22:49:48', '2025-03-16 22:49:48', 49, 49),
(68, 64, 64, 813, 425, NULL, NULL, 'Chanh dây', 35000.00, 35000.00, 1, 0.00, 35000.00, 0, 4, 0.00, 'Flash Sale 06:00 PM giảm 0% áp dụng lúc 18:00 ngày 16/03/2025', '2025-03-16 22:49:48', '2025-03-16 22:49:48', 49, 49),
(69, 64, 64, 818, 430, NULL, NULL, 'Măng tây', 76000.00, 76000.00, 1, 0.00, 76000.00, 0, 4, 0.00, 'Flash Sale 06:00 PM giảm 0% áp dụng lúc 18:00 ngày 16/03/2025', '2025-03-16 22:49:48', '2025-03-16 22:49:48', 49, 49),
(70, 65, 65, 823, 435, NULL, NULL, 'Mật ong', 225000.00, 225000.00, 1, 0.00, 225000.00, 0, NULL, 0.00, NULL, '2025-03-19 15:20:15', '2025-03-19 15:20:15', 53, 53),
(71, 65, 65, 834, 446, NULL, NULL, 'Thịt ốc bươu', 30000.00, 30000.00, 1, 0.00, 30000.00, 0, NULL, 0.00, NULL, '2025-03-19 15:20:15', '2025-03-19 15:20:15', 53, 53),
(72, 66, 66, 1100, 716, 9, 80, 'sản phẩm siêu test', 100000.00, 100000.00, 1, 10000.00, 100000.00, 0, NULL, 0.00, NULL, '2025-04-08 16:45:24', '2025-04-08 16:45:24', 59, 59),
(73, 67, 67, 1100, 716, 9, 80, 'sản phẩm siêu test', 100000.00, 100000.00, 1, 10000.00, 100000.00, 0, NULL, 0.00, NULL, '2025-04-14 14:06:13', '2025-04-14 14:06:13', 59, 59),
(74, 68, 68, 838, 450, NULL, NULL, 'Táo Gala Pháp', 69000.00, 69000.00, 1, 0.00, 69000.00, 0, NULL, 0.00, NULL, '2025-04-16 15:46:36', '2025-04-16 15:46:36', 53, 53),
(80, 74, 74, 829, 441, NULL, NULL, 'Lươn', 51000.00, 51000.00, 3, 0.00, 153000.00, 0, 4, 0.00, 'Flash Sale 06:00 PM giảm 0% áp dụng lúc 18:00 ngày 18/04/2025', '2025-04-18 20:04:38', '2025-04-18 20:04:38', 48, 48),
(81, 74, 74, 837, 449, NULL, NULL, 'Cam sành vắt nước', 36500.00, 36500.00, 2, 0.00, 73000.00, 0, 4, 0.00, 'Flash Sale 06:00 PM giảm 0% áp dụng lúc 18:00 ngày 18/04/2025', '2025-04-18 20:04:38', '2025-04-18 20:04:38', 48, 48),
(83, 76, 76, 818, 430, NULL, NULL, 'Măng tây', 76000.00, 76000.00, 4, 0.00, 304000.00, 0, 4, 0.00, 'Flash Sale 06:00 PM giảm 0% áp dụng lúc 18:00 ngày 18/04/2025', '2025-04-18 20:08:13', '2025-04-18 20:08:13', 48, 48),
(90, 84, 83, 1100, 716, NULL, NULL, 'sản phẩm siêu test', 100000.00, 100000.00, 1, 0.00, 100000.00, 0, NULL, 0.00, NULL, '2025-05-05 13:22:41', '2025-05-05 13:22:41', 59, 59),
(91, 85, 84, 1100, 716, NULL, NULL, 'sản phẩm siêu test', 100000.00, 100000.00, 1, 0.00, 100000.00, 0, NULL, 0.00, NULL, '2025-05-05 13:34:31', '2025-05-05 13:34:31', 59, 59),
(93, 87, 86, 1100, 716, NULL, NULL, 'sản phẩm siêu test', 100000.00, 90000.00, 1, 0.00, 90000.00, 0, 5, 10000.00, '123234 giảm 10% áp dụng lúc 06:00 ngày 08/05/2025', '2025-05-08 08:54:44', '2025-05-08 08:54:44', 59, 59),
(94, 88, 87, 1100, 716, NULL, NULL, 'sản phẩm siêu test', 100000.00, 90000.00, 1, 0.00, 90000.00, 0, 5, 10000.00, '123234 giảm 10% áp dụng lúc 06:00 ngày 08/05/2025', '2025-05-08 09:22:50', '2025-05-08 09:22:50', 59, 59),
(95, 89, 88, 1100, 716, NULL, NULL, 'sản phẩm siêu test', 100000.00, 90000.00, 1, 0.00, 90000.00, 1, 5, 10000.00, '123234 giảm 10% áp dụng lúc 06:00 ngày 08/05/2025', '2025-05-08 09:53:17', '2025-05-08 09:53:17', 59, 59),
(96, 90, 89, 1100, 716, NULL, NULL, 'sản phẩm siêu test', 100000.00, 90000.00, 1, 0.00, 90000.00, 1, 5, 10000.00, '123234 giảm 10% áp dụng lúc 06:00 ngày 08/05/2025', '2025-05-08 10:26:23', '2025-05-08 10:26:23', 59, 59),
(97, 91, 90, 1100, 716, NULL, NULL, 'sản phẩm siêu test', 100000.00, 90000.00, 1, 0.00, 90000.00, 1, 5, 10000.00, '123234 giảm 10% áp dụng lúc 06:00 ngày 08/05/2025', '2025-05-08 11:05:50', '2025-05-08 11:05:50', 59, 59),
(98, 96, 91, 1100, 716, NULL, NULL, 'sản phẩm siêu test', 100000.00, 90000.00, 1, 0.00, 90000.00, 0, 5, 10000.00, '123234 giảm 10% áp dụng lúc 06:00 ngày 13/05/2025', '2025-05-13 09:11:23', '2025-05-13 09:11:23', 59, 59),
(99, 97, 92, 1100, 716, NULL, NULL, 'sản phẩm siêu test', 100000.00, 90000.00, 1, 0.00, 90000.00, 0, 5, 10000.00, '123234 giảm 10% áp dụng lúc 06:00 ngày 13/05/2025', '2025-05-13 11:05:01', '2025-05-13 11:05:01', 59, 59),
(100, 98, 93, 1202, 818, NULL, NULL, 'Sản phẩm dùng để test', 50000.00, 50000.00, 1, 0.00, 50000.00, 0, NULL, 0.00, NULL, '2025-05-13 13:07:20', '2025-05-13 13:07:20', 59, 59),
(101, 98, 94, 1100, 716, NULL, NULL, 'sản phẩm siêu test', 100000.00, 100000.00, 1, 0.00, 100000.00, 0, NULL, 0.00, NULL, '2025-05-13 13:07:21', '2025-05-13 13:07:21', 59, 59),
(102, 99, 95, 1202, 818, NULL, NULL, 'Sản phẩm dùng để test', 50000.00, 50000.00, 1, 0.00, 50000.00, 0, NULL, 0.00, NULL, '2025-05-13 13:17:55', '2025-05-13 13:17:55', 59, 59),
(103, 99, 96, 1100, 716, NULL, NULL, 'sản phẩm siêu test', 100000.00, 100000.00, 1, 0.00, 100000.00, 0, NULL, 0.00, NULL, '2025-05-13 13:17:55', '2025-05-13 13:17:55', 59, 59),
(104, 101, 97, 1100, 716, NULL, NULL, 'sản phẩm siêu test', 100000.00, 100000.00, 1, 0.00, 100000.00, 0, NULL, 0.00, NULL, '2025-05-13 14:52:48', '2025-05-13 14:52:48', 59, 59),
(105, 101, 98, 1100, 716, NULL, NULL, 'sản phẩm siêu test', 100000.00, 100000.00, 1, 0.00, 100000.00, 0, NULL, 0.00, NULL, '2025-05-13 14:52:48', '2025-05-13 14:52:48', 59, 59),
(106, 102, 99, 1100, 716, NULL, NULL, 'sản phẩm siêu test', 100000.00, 100000.00, 1, 0.00, 100000.00, 0, NULL, 0.00, NULL, '2025-05-13 14:54:46', '2025-05-13 14:54:46', 59, 59),
(107, 102, 100, 1100, 716, NULL, NULL, 'sản phẩm siêu test', 100000.00, 100000.00, 1, 0.00, 100000.00, 0, NULL, 0.00, NULL, '2025-05-13 14:54:46', '2025-05-13 14:54:46', 59, 59),
(108, 103, 101, 1202, 818, NULL, NULL, 'Sản phẩm dùng để test', 50000.00, 50000.00, 1, 0.00, 50000.00, 0, NULL, 0.00, NULL, '2025-05-13 16:00:22', '2025-05-13 16:00:22', 59, 59),
(109, 103, 102, 1100, 716, NULL, NULL, 'sản phẩm siêu test', 100000.00, 100000.00, 1, 0.00, 100000.00, 0, NULL, 0.00, NULL, '2025-05-13 16:00:22', '2025-05-13 16:00:22', 59, 59),
(110, 104, 103, 1100, 716, NULL, NULL, 'sản phẩm siêu test', 100000.00, 100000.00, 1, 0.00, 100000.00, 0, NULL, 0.00, NULL, '2025-05-13 16:16:24', '2025-05-13 16:16:24', 59, 59),
(111, 105, 104, 1100, 716, NULL, NULL, 'sản phẩm siêu test', 100000.00, 100000.00, 1, 0.00, 100000.00, 0, NULL, 0.00, NULL, '2025-05-13 16:22:43', '2025-05-13 16:22:43', 59, 59),
(112, 106, 105, 1100, 716, NULL, NULL, 'sản phẩm siêu test', 100000.00, 100000.00, 1, 0.00, 100000.00, 0, NULL, 0.00, NULL, '2025-05-13 16:23:37', '2025-05-13 16:23:37', 59, 59),
(113, 107, 106, 1202, 818, NULL, NULL, 'Sản phẩm dùng để test', 50000.00, 50000.00, 1, 0.00, 50000.00, 0, NULL, 0.00, NULL, '2025-05-13 16:27:16', '2025-05-13 16:27:16', 59, 59),
(114, 107, 107, 1100, 716, NULL, NULL, 'sản phẩm siêu test', 100000.00, 100000.00, 1, 0.00, 100000.00, 0, NULL, 0.00, NULL, '2025-05-13 16:27:16', '2025-05-13 16:27:16', 59, 59),
(115, 108, 108, 1202, 818, NULL, NULL, 'Sản phẩm dùng để test', 50000.00, 50000.00, 1, 0.00, 50000.00, 0, NULL, 0.00, NULL, '2025-05-14 15:12:31', '2025-05-14 15:12:31', 59, 59),
(116, 108, 109, 1100, 716, NULL, NULL, 'sản phẩm siêu test', 100000.00, 100000.00, 1, 0.00, 100000.00, 0, NULL, 0.00, NULL, '2025-05-14 15:12:31', '2025-05-14 15:12:31', 59, 59),
(117, 109, 110, 1202, 818, NULL, NULL, 'Sản phẩm dùng để test', 50000.00, 50000.00, 2, 0.00, 100000.00, 0, NULL, 0.00, NULL, '2025-05-15 10:13:18', '2025-05-15 10:13:18', 59, 59),
(118, 109, 111, 1100, 716, NULL, NULL, 'sản phẩm siêu test', 100000.00, 90000.00, 2, 0.00, 180000.00, 0, 5, 10000.00, '123234 giảm 10% áp dụng lúc 06:00 ngày 15/05/2025', '2025-05-15 10:13:18', '2025-05-15 10:13:18', 59, 59),
(125, 113, 118, 1202, 818, NULL, NULL, 'Sản phẩm dùng để test', 50000.00, 50000.00, 1, 0.00, 50000.00, 0, NULL, 0.00, NULL, '2025-05-15 14:57:33', '2025-05-15 14:57:33', 59, 59),
(126, 113, 119, 1100, 716, NULL, NULL, 'sản phẩm siêu test', 100000.00, 100000.00, 1, 0.00, 100000.00, 0, NULL, 0.00, NULL, '2025-05-15 14:57:34', '2025-05-15 14:57:34', 59, 59),
(127, 114, 120, 1202, 818, NULL, NULL, 'Sản phẩm dùng để test', 50000.00, 50000.00, 1, 0.00, 50000.00, 0, NULL, 0.00, NULL, '2025-05-20 09:54:02', '2025-05-20 09:54:02', 59, 59),
(128, 114, 121, 1100, 716, NULL, NULL, 'sản phẩm siêu test', 100000.00, 90000.00, 1, 0.00, 90000.00, 0, 5, 10000.00, '123234 giảm 10% áp dụng lúc 06:00 ngày 20/05/2025', '2025-05-20 09:54:02', '2025-05-20 09:54:02', 59, 59),
(129, 115, 122, 834, 446, NULL, NULL, 'Thịt ốc bươu', 30000.00, 30000.00, 4, 0.00, 120000.00, 0, NULL, 0.00, NULL, '2025-05-28 15:46:19', '2025-05-28 15:46:19', 62, 62),
(130, 116, 123, 838, 450, NULL, NULL, 'Táo Gala Pháp', 69000.00, 69000.00, 3, 0.00, 207000.00, 0, NULL, 0.00, NULL, '2025-05-28 16:01:38', '2025-05-28 16:01:38', 62, 62),
(131, 117, 124, 1100, 716, NULL, NULL, 'sản phẩm siêu test', 100000.00, 100000.00, 1, 0.00, 100000.00, 0, NULL, 0.00, NULL, '2025-06-02 12:33:20', '2025-06-02 12:33:20', 59, 59),
(132, 118, 125, 1100, 716, NULL, NULL, 'sản phẩm siêu test', 100000.00, 100000.00, 1, 0.00, 100000.00, 0, NULL, 0.00, NULL, '2025-06-02 16:15:00', '2025-06-02 16:15:00', 59, 59),
(133, 119, 126, 1100, 716, NULL, NULL, 'sản phẩm siêu test', 100000.00, 90000.00, 1, 0.00, 90000.00, 0, 5, 10000.00, '123234 giảm 10% áp dụng lúc 06:00 ngày 03/06/2025', '2025-06-03 09:50:02', '2025-06-03 09:50:02', 59, 59),
(134, 120, 127, 833, 445, NULL, NULL, 'Tép', 88000.00, 88000.00, 1, 0.00, 88000.00, 0, NULL, 0.00, NULL, '2025-06-03 09:56:47', '2025-06-03 09:56:47', 59, 59),
(135, 121, 128, 1217, 833, NULL, NULL, 'Hoa quả', 0.00, 0.00, 2, 0.00, 0.00, 0, NULL, 0.00, NULL, '2025-06-04 15:56:56', '2025-06-04 15:56:56', 62, 62),
(136, 122, 129, 1217, 833, NULL, NULL, 'Hoa quả', 0.00, 0.00, 2, 0.00, 0.00, 0, NULL, 0.00, NULL, '2025-06-04 17:15:12', '2025-06-04 17:15:12', 62, 62),
(137, 123, 130, 1100, 716, NULL, NULL, 'sản phẩm siêu test', 100000.00, 100000.00, 1, 0.00, 100000.00, 0, NULL, 0.00, NULL, '2025-06-05 15:29:41', '2025-06-05 15:29:41', 59, 59),
(138, 124, 131, 1209, 825, NULL, NULL, 'Mì Cay Nongshim Shincup', 30000.00, 30000.00, 2, 0.00, 60000.00, 0, NULL, 0.00, NULL, '2025-06-05 16:21:35', '2025-06-05 16:21:35', 15, 15),
(139, 125, 132, 838, 450, NULL, NULL, 'Táo Gala Pháp', 69000.00, 69000.00, 1, 0.00, 69000.00, 0, NULL, 0.00, NULL, '2025-06-05 17:46:44', '2025-06-05 17:46:44', 15, 15),
(140, 125, 132, 834, 446, NULL, NULL, 'Thịt ốc bươu', 30000.00, 30000.00, 1, 0.00, 30000.00, 0, NULL, 0.00, NULL, '2025-06-05 17:46:44', '2025-06-05 17:46:44', 15, 15),
(141, 126, 133, 833, 445, NULL, NULL, 'Tép', 88000.00, 88000.00, 1, 0.00, 88000.00, 0, NULL, 0.00, NULL, '2025-06-06 10:52:45', '2025-06-06 10:52:45', 15, 15),
(142, 127, 134, 825, 437, NULL, NULL, 'Đường mía', 15500.00, 15500.00, 2, 0.00, 31000.00, 0, NULL, 0.00, NULL, '2025-06-06 16:51:09', '2025-06-06 16:51:09', 15, 15),
(143, 128, 135, 1051, 667, NULL, NULL, 'Cafe Đen', 25000.00, 25000.00, 2, 0.00, 50000.00, 0, NULL, 0.00, NULL, '2025-06-15 17:04:39', '2025-06-15 17:04:39', 15, 15);

--
-- Chỉ mục cho các bảng đã đổ
--

--
-- Chỉ mục cho bảng `order_item`
--
ALTER TABLE `order_item`
  ADD PRIMARY KEY (`id`) USING BTREE,
  ADD KEY `order_id` (`order_id`),
  ADD KEY `order_shop_id` (`order_store_id`),
  ADD KEY `product_id` (`product_id`),
  ADD KEY `product_price_id` (`product_price_id`),
  ADD KEY `promotion_id` (`promotion_id`),
  ADD KEY `product_seller_id` (`product_seller_id`),
  ADD KEY `seller_id` (`seller_id`);

--
-- AUTO_INCREMENT cho các bảng đã đổ
--

--
-- AUTO_INCREMENT cho bảng `order_item`
--
ALTER TABLE `order_item`
  MODIFY `id` int(11) NOT NULL AUTO_INCREMENT, AUTO_INCREMENT=144;
COMMIT;

/*!40101 SET CHARACTER_SET_CLIENT=@OLD_CHARACTER_SET_CLIENT */;
/*!40101 SET CHARACTER_SET_RESULTS=@OLD_CHARACTER_SET_RESULTS */;
/*!40101 SET COLLATION_CONNECTION=@OLD_COLLATION_CONNECTION */;
